<?xml version="1.0" encoding="UTF-8"?>
<lib:Library xmlns:lib="http://www.epam.example.org/Library"
            xmlns:xsi="http://www.w3.org/2001/XMLSchema-instance"
            xsi:schemaLocation="http://www.epam.example.org/Library XSD_1.xsd">
    <lib:Book ID="201">
        <lib:Genre>Novel</lib:Genre>
        <lib:Title>Gone with the Wind</lib:Title>
        <lib:Author>
            <lib:FirstName>Margaret</lib:FirstName>
            <lib:LastName>Mitchell</lib:LastName>
        </lib:Author>
        <lib:CountPage>854</lib:CountPage>
        <lib:YearCreate>1936</lib:YearCreate>
        <lib:Country>USA</lib:Country>
    </lib:Book>
    <lib:Book ID="203">
        <lib:Genre>Novel</lib:Genre>
        <lib:Title>War and Peace</lib:Title>
        <lib:Author>
            <lib:FirstName>Leo</lib:FirstName>
            <lib:LastName>Tolstoy</lib:LastName>
        </lib:Author>
        <lib:CountPage>854</lib:CountPage>
        <lib:YearCreate>1869</lib:YearCreate>
        <lib:Country>Russia</lib:Country>
    </lib:Book>
    <lib:LibraryName>National Library</lib:LibraryName>
</lib:Library>